subject,headline,category,summary,as_of_date
Sample Striker,Sample Striker linked with Premier League move,rumour,Unconfirmed reports suggest a rival Premier League club has made an informal enquiry.,2025-05-20
Sample Striker,Manager praises Sample Striker's pressing work,tactical,The club's manager highlighted Sample Striker's off-ball work in a recent press conference.,2025-05-15
Manchester United,Manchester United continue squad rebuild under Ruben Amorim,tactical,Reports describe ongoing changes to the squad's tactical setup ahead of the new season.,2025-05-22
Manchester United,Manchester United in contract talks with academy prospects,contract,The club is reportedly in discussions to extend several academy players' contracts.,2025-05-18
Youri Tielemans,Manchester United activate release clause for Youri Tielemans,confirmed,Multiple reports confirm United have triggered Tielemans' reported £35m release clause at Aston Villa and are in advanced talks to complete the signing; the transfer had not been officially completed as of this report.,2026-07-13
Manchester United,Manchester United in advanced talks to sign Youri Tielemans,confirmed,United have activated a release clause for Aston Villa midfielder Youri Tielemans and are in advanced talks to complete a deal reported at £35m.,2026-07-13
